{
	"title": "Valid unlock transaction",
	"summary": "Valid unlock transaction which includes the unlock for the same account",
	"config": {
		"network": "devnet"
	},
	"runner": "unlock_transaction",
	"handler": "unlock_transaction",
	"testCases": [
		{
			"description": "Valid unlock transaction",
			"input": {
				"account": {
					"passphrase": "lava toe nuclear candy erode present guilt develop include type pluck current",
					"publicKey": "jD2BsVVfvkaSrfoQJu4hwENjO5NpkkzyeQ4uD8a0emY=",
					"address": "Z24KgZP2PRUkAslR/oNN9lbG3og="
				},
				"networkIdentifier": "5I/riNtbXPWtcdk83NHYebbV7Rh6NrAALMNODvmIMlU=",
				"delegates": [
					{
						"publicKey": "VDDndVBbMUXBJNFdx8hMp8dR7Lafr2U7+x4MkebiL4o=",
						"address": "d7zFYYWkOnuLRXlHngpuDN8Tvls="
					},
					{
						"publicKey": "c6Vs5AqpkSkyUNm9YUcdGREfAjzxgnyb4Yne7XM/nqI=",
						"address": "4db0eKDEfGuretM2kDcdwBm67t0="
					},
					{
						"publicKey": "iNHU6U8kZv5pdwpRDcjmxjiHW3HpbAK0eRzMAyoqZHI=",
						"address": "VAX+lY+xRy/5jb1G79ePlJncbbU="
					},
					{
						"publicKey": "QVg8cfJmqEIA8L/e6bO7mE9tZ/PJA7pyiMl/Elm/jdw=",
						"address": "/E8iN5x8/RLbzjPYhZEVEQ8Orfs="
					},
					{
						"publicKey": "UVg3ncEQx/wBHPr1JGYBZmiuzGXlv6ecKVjhbaMEkL0=",
						"address": "Mnbi245MZqZJyfj/E3ENQ3xUFNE="
					},
					{
						"publicKey": "fK4fCOSkpDfP/sUJlR7R8wRRQV//clrapGptiUbpV4c=",
						"address": "ErBkLUwRx8pFHmxa6/Gp8padnNo="
					},
					{
						"publicKey": "97nqRDvcGAzUEW4qhuMCY5tLQWWdgY1QEb//BkJFPDo=",
						"address": "14M2a7h/K8l9zKVc5f15BmeoFv4="
					},
					{
						"publicKey": "U+/i4bZuo1o1bgf5nb/XmWXpTnizuACHSF448l/4C3Q=",
						"address": "wr1805a33lSbeJOREog8kMX2Y5E="
					},
					{
						"publicKey": "Qzj4yEF/lvMVaY7GcOjpw1yqCDAYH1VU9hi6iCnUNvA=",
						"address": "zwDhvy0SrGZUvBxjxaW5FbN/ZYk="
					},
					{
						"publicKey": "yoEls6EqL4rUem1RSwDDYHZt9XhdVyA3SPuMYwkgIPo=",
						"address": "pZlDXL6CtdTugvGX16HyPYpJorw="
					},
					{
						"publicKey": "J7fwFhH5WIor9Dd0ubiQztve9pXxuETIFYc/L+zx4p4=",
						"address": "6oa57jHNrn360tJ8vy9RuEphXmc="
					},
					{
						"publicKey": "b/TCt98BMxZha2trZ+0QKJQYSk787jZf0bRZ5NBwzKA=",
						"address": "HoC5Gre50InRBFR/hlOTLUs5Vy0="
					},
					{
						"publicKey": "4fIKixxkGT218An9TYj96b0TILjJIfr+gAus2Uw0eis=",
						"address": "mhC8UDw1gR1EC3uWqt6TRG1RjhY="
					},
					{
						"publicKey": "HrMBMopWgaTToALIkmRO/MBXQ2mF1I1VJhEz2uCvXEE=",
						"address": "f6TNwxSb787pMISHanQQ475sNE8="
					},
					{
						"publicKey": "A1UIXU1swlZcaaJIhG6dHLevAj+NOisxRFoDhqRXWKQ=",
						"address": "33TZBfsTHoSu5kKvs85/EgDF6JA="
					},
					{
						"publicKey": "90DyL/RBN1dFfNJbOQ9TErWxDdCfTtkBhIpXy4S8EmE=",
						"address": "4ltStCMLSSxYDR4JLRKTa+Jxykg="
					},
					{
						"publicKey": "Cb8L1ZPzVPeUnLv0LO39yfq9LX2l/yTg8kxAF+vbdFA=",
						"address": "AskT2dgV3k/YHPwPahSNjo6jDdE="
					},
					{
						"publicKey": "KZiuXGsoOI/WVCYsoZpNZpq/Bnqioo+i7LlAedE4bsk=",
						"address": "0Smk0KZr1J7kRvpxHk2oU/UtoIU="
					},
					{
						"publicKey": "+LKC/na+0R4ASPZo4naPG1NGrNd7Ov4qAcmzh0YS+6I=",
						"address": "R0dZtNKK64tS9pxRO4xcV3YF5E0="
					},
					{
						"publicKey": "GVKMQfdJ+wrNhAtTSYI6/qjZbZOAz0xnSlz1IkF6aUY=",
						"address": "RETTPY2Wo9EelimD9bNsgdn6RSg="
					}
				]
			},
			"output": {
				"transaction": "CA4QAxiA3qDLBSIgjD2BsVVfvkaSrfoQJu4hwENjO5NpkkzyeQ4uD8a0emYqkgUCHgoUd7zFYYWkOnuLRXlHngpuDN8TvlsQgJTr3AMYIAIfChTh1vR4oMR8a6t60zaQNx3AGbru3RCA6O2hugEYDAIfChRUBf6Vj7FHL/mNvUbv14+UmdxttRCAgPKLqAkYDgIfChR3vMVhhaQ6e4tFeUeeCm4M3xO+WxCA0M3PnAwYEwIfChR3vMVhhaQ6e4tFeUeeCm4M3xO+WxCAoKmTkQ8YMgIfChRUBf6Vj7FHL/mNvUbv14+UmdxttRCA8ITXhRIYDgIfChRUBf6Vj7FHL/mNvUbv14+UmdxttRCA8ITXhRIYDgIfChT8TyI3nHz9EtvOM9iFkRURDw6t+xCA4Jei4xoYIQIfChQyduLbjkxmpknJ+P8TcQ1DfFQU0RCA8JnFiQQYEwIfChQSsGQtTBHHykUebFrr8anylp2c2hCAqOqk5AMYNQIeChTXgzZruH8ryX3MpVzl/XkGZ6gW/hCAlOvcAxggAh8KFMK9fNOWt95Um3iTkRKIPJDF9mOREIDo7aG6ARgSAh8KFM8A4b8tEqxmVLwcY8WluRWzf2WJEICA8ouoCRgdAh8KFKWZQ1y+grXU7oLxl9eh8j2KSaK8EIDQzc+cDBgGAh8KFGduCoGT9j0VJALJUf6DTfZWxt6IEICgqZORDxgsAh8KFB6AuRq3udCJ0QRUf4ZTky1LOVctEIDwhNeFEhgpAh8KFJoQvFA8NYEdRAt7lqrek0RtUY4WEICQvN7uFxgNAh8KFH+kzcMUm+/O6TCEh2p0EOO+bDRPEIDgl6LjGhgZAh8KFN902QX7Ex6EruZCr7POfxIAxeiQEIDwmcWJBBgfAh8KFOJbUrQjC0ksWA0eCS0Sk2viccpIEICo6qTkAxgVMkDhiMWcCL4FmjtJ86+rbVSUDXg+vUwKEUei2+Stn6Apa4AY3HPk0JSSI2y6ud3hzt6dTwOzm4VxwLP7nzTsHdUA"
			}
		}
	]
}
