{
	"title": "Valid bytes encodings",
	"summary": "Examples of encoding bytes as required by lisk-codec",
	"config": {
		"network": "devnet"
	},
	"runner": "lisk_codec",
	"handler": "validBytesEncodings",
	"testCases": [
		{
			"description": "Encoding of bytes types",
			"config": {
				"network": "devnet"
			},
			"input": {
				"bytes": {
					"object": {
						"address": "e11a11364738225813f86ea85214400e5db08d6e"
					},
					"schema": {
						"type": "object",
						"properties": {
							"address": {
								"dataType": "bytes",
								"fieldNumber": 1
							}
						}
					}
				},
				"emptyBytes": {
					"object": {
						"address": {
							"type": "Buffer",
							"data": []
						}
					},
					"schema": {
						"type": "object",
						"properties": {
							"data": {
								"dataType": "string",
								"fieldNumber": 1
							}
						}
					}
				}
			},
			"output": {
				"bytes": "0a14e11a11364738225813f86ea85214400e5db08d6e",
				"emptyBytes": "0a00"
			}
		}
	]
}
