{
	"title": "Valid object encodings",
	"summary": "Examples of encoding objects as required by lisk-codec",
	"config": {
		"network": "devnet"
	},
	"runner": "lisk_codec",
	"handler": "validObjectEncodings",
	"testCases": [
		{
			"description": "Encoding of object types",
			"config": {
				"network": "devnet"
			},
			"input": {
				"object": {
					"object": {
						"address": "e11a11364738225813f86ea85214400e5db08d6e",
						"balance": 10000000,
						"isDelegate": true,
						"name": "delegate",
						"asset": {
							"data": "Check out the Lisk SDK now in binary!"
						}
					},
					"schema": {
						"type": "object",
						"properties": {
							"address": {
								"dataType": "bytes",
								"fieldNumber": 1
							},
							"balance": {
								"dataType": "uint64",
								"fieldNumber": 2
							},
							"isDelegate": {
								"dataType": "boolean",
								"fieldNumber": 3
							},
							"name": {
								"dataType": "string",
								"fieldNumber": 4
							},
							"asset": {
								"type": "object",
								"fieldNumber": 5,
								"properties": {
									"data": {
										"dataType": "string",
										"fieldNumber": 1
									}
								}
							}
						}
					}
				},
				"objectWithOptionalProp": {
					"object": {
						"isActive": true,
						"value": 1
					},
					"schema": {
						"type": "object",
						"properties": {
							"isActive": {
								"dataType": "boolean",
								"fieldNumber": 1
							},
							"balance": {
								"data": "bytes",
								"fieldNumber": 2
							},
							"value": {
								"dataType": "uint64",
								"fieldNumber": 3
							}
						}
					}
				}
			},
			"output": {
				"object": "0a14e11a11364738225813f86ea85214400e5db08d6e1080ade2041801220864656c65676174652a270a25436865636b206f757420746865204c69736b2053444b206e6f7720696e2062696e61727921",
				"objectWithOptionalProp": "08011801"
			}
		}
	]
}
