{
	"title": "Valid transfer transaction with multi signature",
	"summary": "A valid transfer transaction with multi signature",
	"config": {
		"network": "devnet"
	},
	"runner": "transaction_network_id_and_change_order",
	"handler": "transfer_transaction_with_multi_signature_validate",
	"testCases": [
		{
			"description": "A valid transfer transaction with multi signature",
			"input": {
				"account": {
					"passphrase": "wear protect skill sentence lift enter wild sting lottery power floor neglect",
					"privateKey": "8f41ff1e75c4f0f8a71bae4952266928d0e91660fc513566ac694fed61157497efaf1d977897cb60d7db9d30e8fd668dee070ac0db1fb8d184c06152a8b75f8d",
					"publicKey": "efaf1d977897cb60d7db9d30e8fd668dee070ac0db1fb8d184c06152a8b75f8d",
					"address": "2129300327344985743L",
					"nonce": "2"
				},
				"coSigners": [
					{
						"passphrase": "better across runway mansion jar route valid crack panic favorite smooth sword",
						"privateKey": "de1520f8589408e76a97643ba7d27f20009b06899816c8af20f9b03f4a4bd8a66766ce280eb99e45d2cc7d9c8c852720940dab5d69f480e80477a97b4255d5d8",
						"publicKey": "6766ce280eb99e45d2cc7d9c8c852720940dab5d69f480e80477a97b4255d5d8",
						"address": "13191770412077040757L",
						"nonce": "2"
					},
					{
						"passphrase": "mirror swap middle hunt angle furnace maid scheme amazing box bachelor debris",
						"privateKey": "ad7462eb8f682b0c3424213ead044381ba0007bb65ce26287fc308027c871d951387d8ec6306807ffd6fe27ea3443985765c1157928bb09904307956f46a9972",
						"publicKey": "1387d8ec6306807ffd6fe27ea3443985765c1157928bb09904307956f46a9972",
						"address": "2443122499609067441L",
						"nonce": "2"
					}
				],
				"networkIdentifier": "e48feb88db5b5cf5ad71d93cdcd1d879b6d5ed187a36b0002cc34e0ef9883255",
				"transaction": {
					"type": 8,
					"senderPublicKey": "efaf1d977897cb60d7db9d30e8fd668dee070ac0db1fb8d184c06152a8b75f8d",
					"nonce": "2",
					"fee": "100000000",
					"asset": {
						"recipientId": "18141291412139607230L",
						"amount": "1234567890",
						"data": "random data"
					}
				}
			},
			"output": {
				"type": 8,
				"senderPublicKey": "efaf1d977897cb60d7db9d30e8fd668dee070ac0db1fb8d184c06152a8b75f8d",
				"nonce": "2",
				"fee": "100000000",
				"asset": {
					"recipientId": "18141291412139607230L",
					"amount": "1234567890",
					"data": "random data"
				},
				"signature": "e98d7ec13909c2d8d58c4bafdf723b6f88480619b237c58dc96c9ae6cad7e74f8b8cfe72f0137827b17c0ba1def07f6fa92af22872a23060bbdae6651bb98807",
				"signatures": [
					"c9c01590063c037edc356b9506db81adbbd2026e29e714d257ee8f8ebc2c6c8c08c7228c83d4a59a42c7364d519c10de31e20b6c393be15b33e2a1f67cd10009",
					"6810d1113a528927dbbbf78e427d675e9ed1c8e5008aa75877bc8aa2a2257cdff977ac938c5210ac0d4506138c46cedeeeee8b0ec96411352131a0cdd8e03406"
				],
				"id": "14028804809042236201"
			}
		}
	]
}
