{
	"title": "Valid delegate transaction",
	"summary": "A valid delegate transaction",
	"config": {
		"network": "devnet"
	},
	"runner": "transaction_network_id_and_change_order",
	"handler": "delegate_transaction_validate",
	"testCases": [
		{
			"description": "A valid delegate transaction",
			"input": {
				"account": {
					"passphrase": "wear protect skill sentence lift enter wild sting lottery power floor neglect",
					"privateKey": "8f41ff1e75c4f0f8a71bae4952266928d0e91660fc513566ac694fed61157497efaf1d977897cb60d7db9d30e8fd668dee070ac0db1fb8d184c06152a8b75f8d",
					"publicKey": "efaf1d977897cb60d7db9d30e8fd668dee070ac0db1fb8d184c06152a8b75f8d",
					"address": "2129300327344985743L",
					"nonce": "2"
				},
				"networkIdentifier": "e48feb88db5b5cf5ad71d93cdcd1d879b6d5ed187a36b0002cc34e0ef9883255",
				"transaction": {
					"type": 10,
					"senderPublicKey": "efaf1d977897cb60d7db9d30e8fd668dee070ac0db1fb8d184c06152a8b75f8d",
					"nonce": "2",
					"fee": "100000000",
					"asset": {
						"username": "new_delegate"
					}
				}
			},
			"output": {
				"type": 10,
				"senderPublicKey": "efaf1d977897cb60d7db9d30e8fd668dee070ac0db1fb8d184c06152a8b75f8d",
				"nonce": "2",
				"fee": "100000000",
				"asset": {
					"username": "new_delegate"
				},
				"signature": "eeaee4c7abec51ac6b8f406c281ca073d99bb455dbc8f5ccbc137b34ccb92e372cd93f2256e8978d0962efea6def770f7ae65d2616ac1071fd3488a8e0f1b301",
				"id": "18179433578411384385"
			}
		}
	]
}
