{
	"title": "Valid multi signature transaction",
	"summary": "A valid multi signature transaction",
	"config": {
		"network": "devnet"
	},
	"runner": "transaction_network_id_and_change_order",
	"handler": "multi_signature_transaction_validate",
	"testCases": [
		{
			"description": "A valid multi signature transaction",
			"input": {
				"account": {
					"passphrase": "wear protect skill sentence lift enter wild sting lottery power floor neglect",
					"privateKey": "8f41ff1e75c4f0f8a71bae4952266928d0e91660fc513566ac694fed61157497efaf1d977897cb60d7db9d30e8fd668dee070ac0db1fb8d184c06152a8b75f8d",
					"publicKey": "efaf1d977897cb60d7db9d30e8fd668dee070ac0db1fb8d184c06152a8b75f8d",
					"address": "2129300327344985743L"
				},
				"networkIdentifier": "e48feb88db5b5cf5ad71d93cdcd1d879b6d5ed187a36b0002cc34e0ef9883255",
				"coSigners": [
					{
						"passphrase": "inherit moon normal relief spring bargain hobby join baby flash fog blood",
						"privateKey": "de4a28610239ceac2ec3f592e36a2ead8ed4ac93cb16aa0d996ab6bb0249da2c0b211fce4b615083701cb8a8c99407e464b2f9aa4f367095322de1b77e5fcfbe",
						"publicKey": "0b211fce4b615083701cb8a8c99407e464b2f9aa4f367095322de1b77e5fcfbe",
						"address": "18141291412139607230L"
					},
					{
						"passphrase": "better across runway mansion jar route valid crack panic favorite smooth sword",
						"privateKey": "de1520f8589408e76a97643ba7d27f20009b06899816c8af20f9b03f4a4bd8a66766ce280eb99e45d2cc7d9c8c852720940dab5d69f480e80477a97b4255d5d8",
						"publicKey": "6766ce280eb99e45d2cc7d9c8c852720940dab5d69f480e80477a97b4255d5d8",
						"address": "13191770412077040757L"
					},
					{
						"passphrase": "mirror swap middle hunt angle furnace maid scheme amazing box bachelor debris",
						"privateKey": "ad7462eb8f682b0c3424213ead044381ba0007bb65ce26287fc308027c871d951387d8ec6306807ffd6fe27ea3443985765c1157928bb09904307956f46a9972",
						"publicKey": "1387d8ec6306807ffd6fe27ea3443985765c1157928bb09904307956f46a9972",
						"address": "2443122499609067441L"
					}
				],
				"transaction": {
					"type": 12,
					"senderPublicKey": "efaf1d977897cb60d7db9d30e8fd668dee070ac0db1fb8d184c06152a8b75f8d",
					"nonce": "2",
					"fee": "100000000",
					"asset": {
						"min": 2,
						"lifetime": 22,
						"keysgroup": [
							"+0b211fce4b615083701cb8a8c99407e464b2f9aa4f367095322de1b77e5fcfbe",
							"+6766ce280eb99e45d2cc7d9c8c852720940dab5d69f480e80477a97b4255d5d8",
							"+1387d8ec6306807ffd6fe27ea3443985765c1157928bb09904307956f46a9972"
						]
					}
				}
			},
			"output": {
				"type": 12,
				"senderPublicKey": "efaf1d977897cb60d7db9d30e8fd668dee070ac0db1fb8d184c06152a8b75f8d",
				"nonce": "2",
				"fee": "100000000",
				"asset": {
					"min": 2,
					"lifetime": 22,
					"keysgroup": [
						"+0b211fce4b615083701cb8a8c99407e464b2f9aa4f367095322de1b77e5fcfbe",
						"+6766ce280eb99e45d2cc7d9c8c852720940dab5d69f480e80477a97b4255d5d8",
						"+1387d8ec6306807ffd6fe27ea3443985765c1157928bb09904307956f46a9972"
					]
				},
				"signature": "86df61f70592776be33928592cd54b7c2a557b402e1b60ff8598e9c8247d0df4a23483cdbef95be38f70128012212193ac6ba092f6dab07c8a5fb850fee8d109",
				"signatures": [
					"d1aec7c58d38825e6f5fea0a6d7a52539894d76a923e06c3d960d251ef144561af15e3568ac8adf1f250c3a5c8c76ad33a91f89c00c17dfcbfb35f4be5066d0c",
					"3d85e3ad5aa4627b145ed086a24b010dd5eb7011556e81aa5e4ddee99950bef5bd65f9b2f9edbe4fe8513b3520d606fc7d92c3b940acb27e1d75ab3e1ff5010a",
					"bb8571ad017d17ee24fde3c79e2a49d9a3ec1507e0333939a2d32d4251cd07a43397dc5c76d5f33c57e39963b4f967d7af792fd2ce811b150f2da1e9bfb85b03"
				],
				"id": "16380453991724472426"
			}
		}
	]
}
