{
	"title": "Valid transfer transaction with second signature",
	"summary": "A valid transfer transaction with second signature",
	"config": {
		"network": "devnet"
	},
	"runner": "transaction_network_id_and_change_order",
	"handler": "transfer_transaction_with_second_signature_validate",
	"testCases": [
		{
			"description": "A valid transfer transaction with second signature",
			"input": {
				"account": {
					"passphrase": "wear protect skill sentence lift enter wild sting lottery power floor neglect",
					"privateKey": "8f41ff1e75c4f0f8a71bae4952266928d0e91660fc513566ac694fed61157497efaf1d977897cb60d7db9d30e8fd668dee070ac0db1fb8d184c06152a8b75f8d",
					"publicKey": "efaf1d977897cb60d7db9d30e8fd668dee070ac0db1fb8d184c06152a8b75f8d",
					"address": "2129300327344985743L"
				},
				"secondPassphrase": "inherit moon normal relief spring bargain hobby join baby flash fog blood",
				"networkIdentifier": "e48feb88db5b5cf5ad71d93cdcd1d879b6d5ed187a36b0002cc34e0ef9883255",
				"transaction": {
					"type": 8,
					"senderPublicKey": "efaf1d977897cb60d7db9d30e8fd668dee070ac0db1fb8d184c06152a8b75f8d",
					"nonce": "2",
					"fee": "100000000",
					"asset": {
						"recipientId": "18141291412139607230L",
						"amount": "1234567890",
						"data": "random data"
					}
				}
			},
			"output": {
				"type": 8,
				"senderPublicKey": "efaf1d977897cb60d7db9d30e8fd668dee070ac0db1fb8d184c06152a8b75f8d",
				"nonce": "2",
				"fee": "100000000",
				"asset": {
					"recipientId": "18141291412139607230L",
					"amount": "1234567890",
					"data": "random data"
				},
				"signature": "5fd60d57a6dffd631e9933d832e83584067ea52748823f85233c9fe1adedd4e1850195031afba9ef4258ddd5f09adec29d3c5ebf24c6e8e4f04d8e47c4e60e0f",
				"signSignature": "e1ea85377dcf63d1a6bee8f93d01f461bafb1bf8df052efc52c6ebed4610f2691ec16289ee4bef1f5933a19221708c0e60e49836b9793e0fa60d16f3af57440f",
				"id": "4737343361801311741"
			}
		}
	]
}
