{
	"title": "Valid transfer transaction",
	"summary": "A valid transfer transaction",
	"config": {
		"network": "devnet"
	},
	"runner": "transaction_network_id_and_change_order",
	"handler": "transfer_transaction_validate",
	"testCases": [
		{
			"description": "A valid transfer transaction",
			"input": {
				"account": {
					"passphrase": "wear protect skill sentence lift enter wild sting lottery power floor neglect",
					"privateKey": "j0H/HnXE8PinG65JUiZpKNDpFmD8UTVmrGlP7WEVdJfvrx2XeJfLYNfbnTDo/WaN7gcKwNsfuNGEwGFSqLdfjQ==",
					"publicKey": "768dl3iXy2DX250w6P1mje4HCsDbH7jRhMBhUqi3X40=",
					"address": "j1aFv13LjB07m7yYz/sNDGB3vhc=",
					"nonce": "2"
				},
				"networkIdentifier": "5I/riNtbXPWtcdk83NHYebbV7Rh6NrAALMNODvmIMlU="
			},
			"output": {
				"transaction": "CAgQAhiAwtcvIiDvrx2XeJfLYNfbnTDo/WaN7gcKwNsfuNGEwGFSqLdfjSopCNKF2MwEEhS+BG0zbNDC+95ivEfiAZk5XS7q3BoLcmFuZG9tIGRhdGEyQKDvZW+Nsw/PIJs1CSnmq2pSviYi1fUNkypj9w2CgD1V8vLDUU1ad+i78+0K+7z9tc/Uaq0Z5wXd+3eImoEZtQA="
			}
		}
	]
}
